{
  "schema_version": "0.11.0",
  "package_id": "builder-generated-docs-update",
  "mission_id": "mission-builder-generated-docs-update",
  "mode": "dry_run",
  "execution_authorized": false,
  "safety_flags": {
    "shell_execution": false,
    "filesystem_mutation": false,
    "git_operations": false,
    "adapter_execution": false,
    "private_context_access": false,
    "autonomous_execution": false
  },
  "mission_intake": {
    "artifact_type": "mission_intake",
    "mission_id": "mission-builder-generated-docs-update",
    "mission_title": "Builder generated documentation update dry-run",
    "requested_by": "example-user",
    "mission_charter_reference": "examples/dry_run_missions/docs_update_dry_run_package.example.md",
    "scope": "Example package generated by the dry-run package builder for public validator testing.",
    "out_of_scope": [
      "Executing shell commands",
      "Mutating repository files",
      "Git operations",
      "Adapter invocation",
      "Private Village context access",
      "Autonomous mission execution"
    ],
    "private_context_required": false,
    "approval_state": "draft",
    "safety_flags": {
      "shell_execution": false,
      "filesystem_mutation": false,
      "git_operations": false,
      "adapter_execution": false,
      "private_context_access": false,
      "autonomous_execution": false
    }
  },
  "dry_run_execution_plan": {
    "artifact_type": "dry_run_execution_plan",
    "mission_id": "mission-builder-generated-docs-update",
    "mode": "dry_run",
    "plan_summary": "Generate a dry-run runtime package for review. No mission execution is authorized or performed.",
    "steps": [
      {
        "step_id": "step-001",
        "description": "Capture public mission scope as a dry-run intake record.",
        "action_type": "plan",
        "execution_allowed": false,
        "expected_evidence": [
          "Mission title",
          "Mission scope",
          "Out-of-scope boundaries"
        ],
        "stop_conditions": [
          "Execution requested",
          "Filesystem mutation requested",
          "Git operation requested",
          "Private context required",
          "Adapter invocation requested"
        ]
      },
      {
        "step_id": "step-002",
        "description": "Generate runtime package records with all execution flags blocked.",
        "action_type": "package",
        "execution_allowed": false,
        "expected_evidence": [
          "Runtime package JSON",
          "Safety flags"
        ],
        "stop_conditions": [
          "Execution requested",
          "Filesystem mutation requested",
          "Git operation requested",
          "Private context required",
          "Adapter invocation requested"
        ]
      },
      {
        "step_id": "step-003",
        "description": "Validate the generated package with the read-only runtime validator.",
        "action_type": "validate",
        "execution_allowed": false,
        "expected_evidence": [
          "Validator pass/fail output"
        ],
        "stop_conditions": [
          "Execution requested",
          "Filesystem mutation requested",
          "Git operation requested",
          "Private context required",
          "Adapter invocation requested"
        ]
      }
    ],
    "safety_flags": {
      "shell_execution": false,
      "filesystem_mutation": false,
      "git_operations": false,
      "adapter_execution": false,
      "private_context_access": false,
      "autonomous_execution": false
    }
  },
  "adapter_invocation_stub": {
    "artifact_type": "adapter_invocation_stub",
    "mission_id": "mission-builder-generated-docs-update",
    "adapter_name": "none",
    "stub_mode": "stub_only",
    "invocation_allowed": false,
    "intended_request": {},
    "blocked_capabilities": [
      "adapter execution",
      "shell execution",
      "filesystem mutation",
      "Git operations",
      "private context access"
    ],
    "safety_flags": {
      "shell_execution": false,
      "filesystem_mutation": false,
      "git_operations": false,
      "adapter_execution": false,
      "private_context_access": false,
      "autonomous_execution": false
    }
  },
  "evidence_collection_stub": {
    "artifact_type": "evidence_collection_stub",
    "mission_id": "mission-builder-generated-docs-update",
    "collection_mode": "declared_only",
    "automatic_collection_allowed": false,
    "expected_evidence": [
      "Generated runtime package JSON",
      "Runtime validator output",
      "Reviewer decision"
    ],
    "missing_evidence": [
      "Validator output not collected by builder",
      "Reviewer decision not collected by builder"
    ],
    "safety_flags": {
      "shell_execution": false,
      "filesystem_mutation": false,
      "git_operations": false,
      "adapter_execution": false,
      "private_context_access": false,
      "autonomous_execution": false
    }
  },
  "runtime_state": {
    "artifact_type": "runtime_state",
    "mission_id": "mission-builder-generated-docs-update",
    "state": "draft",
    "mode": "dry_run",
    "current_phase": "package_generation",
    "open_blockers": [
      "Package has not yet been validated",
      "Package has not yet been reviewed",
      "Execution remains unauthorized"
    ],
    "safety_flags": {
      "shell_execution": false,
      "filesystem_mutation": false,
      "git_operations": false,
      "adapter_execution": false,
      "private_context_access": false,
      "autonomous_execution": false
    }
  },
  "runtime_validation_report": {
    "artifact_type": "runtime_validation_report",
    "mission_id": "mission-builder-generated-docs-update",
    "validation_outcome": "not_run",
    "validated_artifacts": [],
    "errors": [],
    "warnings": [
      "Validation report is a placeholder until the read-only validator is run."
    ],
    "execution_authorized": false,
    "safety_flags": {
      "shell_execution": false,
      "filesystem_mutation": false,
      "git_operations": false,
      "adapter_execution": false,
      "private_context_access": false,
      "autonomous_execution": false
    }
  },
  "runtime_trace": {
    "events": [
      {
        "artifact_type": "runtime_trace_event",
        "event_id": "trace-001",
        "mission_id": "mission-builder-generated-docs-update",
        "event_type": "package_generation",
        "summary": "Dry-run package generated by builder. No execution performed.",
        "evidence_references": [
          "runtime_package.json"
        ],
        "supersedes": null,
        "execution_performed": false
      }
    ]
  },
  "runtime_package_manifest": {
    "artifact_type": "runtime_package_manifest",
    "package_id": "builder-generated-docs-update",
    "mission_id": "mission-builder-generated-docs-update",
    "package_version": "0.11.0",
    "mode": "dry_run",
    "included_artifacts": [
      "mission_intake",
      "dry_run_execution_plan",
      "adapter_invocation_stub",
      "evidence_collection_stub",
      "runtime_state",
      "runtime_validation_report",
      "runtime_trace",
      "runtime_package_manifest",
      "runtime_package_index"
    ],
    "closure_state": "draft",
    "execution_authorized": false,
    "safety_flags": {
      "shell_execution": false,
      "filesystem_mutation": false,
      "git_operations": false,
      "adapter_execution": false,
      "private_context_access": false,
      "autonomous_execution": false
    }
  },
  "runtime_package_index": {
    "artifact_type": "runtime_package_index",
    "package_id": "builder-generated-docs-update",
    "mission_id": "mission-builder-generated-docs-update",
    "artifacts": [
      {
        "artifact_type": "mission_intake",
        "reference": "mission_intake",
        "status": "present"
      },
      {
        "artifact_type": "dry_run_execution_plan",
        "reference": "dry_run_execution_plan",
        "status": "present"
      },
      {
        "artifact_type": "adapter_invocation_stub",
        "reference": "adapter_invocation_stub",
        "status": "present"
      },
      {
        "artifact_type": "evidence_collection_stub",
        "reference": "evidence_collection_stub",
        "status": "present"
      },
      {
        "artifact_type": "runtime_state",
        "reference": "runtime_state",
        "status": "present"
      },
      {
        "artifact_type": "runtime_validation_report",
        "reference": "runtime_validation_report",
        "status": "present"
      },
      {
        "artifact_type": "runtime_package_manifest",
        "reference": "runtime_package_manifest",
        "status": "present"
      },
      {
        "artifact_type": "runtime_package_index",
        "reference": "runtime_package_index",
        "status": "present"
      },
      {
        "artifact_type": "runtime_trace",
        "reference": "runtime_trace.events",
        "status": "present"
      }
    ],
    "trace_references": [
      "runtime_trace.events[0]"
    ],
    "validation_references": [
      "runtime_validation_report"
    ]
  }
}
